{"_meta": {"api_version": "1", "contract_version": "1.14", "generated_at": "2026-07-21T01:52:35+00:00", "provenance": "socrata", "data_tier": "mixed", "tier_note": "The project roster and each status are curated/volunteer-reviewed (derived); the attached news coverage headlines are real (verbatim). The linked official page is authoritative.", "license": "City of Chicago Data Portal Terms of Use (data.cityofchicago.org); derived analyses by On Your Left!", "attribution": "On Your Left! \u2014 Chicago bike safety, on the record (https://github.com/jartinator/chicago-safe-streets-data)", "human_page": "https://jartinator.github.io/chicago-safe-streets-data/action.html", "methodology": "https://jartinator.github.io/chicago-safe-streets-data/methodology.html", "schema": "https://jartinator.github.io/chicago-safe-streets-data/api/v1/schemas/proposed.schema.json"}, "as_of": "2026-07-21T01:52:05+00:00", "note": "Hand-curated roster of active Chicago bikeway/trail proposals and projects. Selection criteria: an official record exists, the outcome is unresolved, and the set keeps geographic spread \u2014 under-covered South and West Side projects are deliberately included; news-coverage volume is not a criterion. Each status is a volunteer-reviewed judgment backed by the citations listed with it (status_as_of = when it was last reviewed); the linked official page is always authoritative. Attached coverage is verbatim headlines from the news_items dataset, matched by each project's curated phrases (auditable via `via`); an empty coverage list measures press attention, not project activity.", "projects": [{"id": "bloomingdale-extension", "name": "Bloomingdale Trail (606) Extension", "status": "in design", "status_as_of": "2026-07-13", "status_note": "Funded in part: a federal earmark secured by Rep. Quigley (~$1.4M reported toward Phase II) against an estimated $30\u201340M total, with state/local sources still being assembled. Preliminary engineering wrapping up; construction expected to start around late 2026, completion late 2027 (timeline per Block Club, Jan 2025).", "description": "Extend the elevated 606/Bloomingdale Trail east from its current end at Ashland Avenue, under the Kennedy Expressway, to Elston Avenue, coordinated with the Lincoln Yards site.", "wards": [], "official_links": [{"text": "CDOT: Bloomingdale Trail Extension", "url": "https://www.chicago.gov/city/en/depts/cdot/supp_info/bloomingdale_trail.html"}], "citations": [{"title": "The 606's Bloomingdale Trail Extension Delayed, With Completion Now Expected By Late 2027", "url": "https://blockclubchicago.org/2025/01/21/the-606s-bloomingdale-trail-extension-delayed-with-completion-now-expected-by-late-2027/", "source": "Block Club Chicago", "published": "2025-01-21"}, {"title": "The planned Bloomingdale Trail extension is short, but it would get you past the Kennedy and Ashland car-free", "url": "https://chi.streetsblog.org/2023/08/08/the-planned-bloomingdale-trail-extension-is-short-but-it-would-get-you-past-the-kennedy-and-ashland-car-free", "source": "Streetsblog Chicago", "published": "2023-08-08"}], "coverage": []}, {"id": "archer-avenue", "name": "Archer Avenue Traffic Safety Project", "status": "installed, being modified", "status_as_of": "2026-07-13", "status_note": "Protected bike lanes with concrete curbs, pedestrian refuge islands, and curb extensions were installed in Brighton Park; after sustained resident protests, the city restored 17 parking spaces across three sub-segments in April 2026 while keeping the concrete-protected lanes \u2014 CDOT says there are no plans to remove the project's core safety features.", "description": "Complete Streets safety redesign of Archer Avenue in Brighton Park (12th Ward), on a corridor CDOT tied to a majority of the area's serious pedestrian/cyclist injuries.", "wards": ["12"], "official_links": [], "citations": [{"title": "City Bringing Back 17 Parking Spots On Brighton Park's Archer Ave After Protests", "url": "https://blockclubchicago.org/2026/04/30/city-removes-brand-new-concrete-bike-lanes-pedestrian-islands-in-brighton-park-amid-protests/", "source": "Block Club Chicago", "published": "2026-04-30"}], "coverage": [{"title": "Letters: The Tribune Editorial Board criticizes Archer Avenue bike lanes while ignoring street safety data", "url": "https://news.google.com/rss/articles/CBMiigFBVV95cUxPbmdHSzFta1gzWHg5eEY2RkhZZW1lU2tVOHRPRFQyemJReFVETzdiNHp1X2dsOGcybHBfSHV2aXlzN0lzRXFKSVRHQmltc1BDQVo0SHQ3QzY1UVJ2SkVEbWQ4RkNjQW9JMG9NSG12T0RKNTF4Y3NYTEltR0lORm1CMnE5bThSTlBCZnc?oc=5", "source": "Chicago Tribune", "published": "2026-05-07T07:00:00+00:00"}, {"title": "Editorial: A sensible compromise on Archer Avenue takes more than bike activists into account", "url": "https://news.google.com/rss/articles/CBMi0AFBVV95cUxNTUNfR1JqN0VFNEl4UlByRjNtUzFpWmlIVXRPd3lJSmMydi04M2lLU1BSa3dTVHFScW5xWlB5WFhMSTRlOVJYY0NyVFJqaXJ1T281aWRhbFhfSW4zQUhIeGlrMHVuUFpvN08yeC13MENyN3ljcW9zZHJKNFNLemdrLWhmeVphcHJHMW9KUUltejYyQVlydmJGMVRPY1JUUlRnTTlWWl9oT3ZYNGF6ZDdQM2NZdjJUN2pvWHh3Mko5TV80TXpuSlhmRlEtQk9xQUxh?oc=5", "source": "Chicago Tribune", "published": "2026-05-01T07:00:00+00:00"}, {"title": "Small business owners protest Archer Avenue bike lanes", "url": "https://news.google.com/rss/articles/CBMiZkFVX3lxTE5GdGdIWVZoSFIxWFNwQnRQdEZqRFVsaGczV3ljcDFKVUlYclg3RHBqUkFGYUtyS28xU1NFWXFvd0RMSFUycGdIUnFPY2tlbDRrUm95VlMwMWNMa0xnc19YV1pVczRhd9IBa0FVX3lxTE5UNnQzVnFqYUM2aUljNHI5REgxWFh0R0RUMjlvNVJXZTlvRXIxTnRaeWFXWllyX3FWaWxVbmthM0YxT1g1VFdKYk1QVDhaTlRPMVpobGpBcG0wbS1sMjd4UDdqdm9Sanl4Nkdr?oc=5", "source": "FOX 32 Chicago", "published": "2026-04-27T07:00:00+00:00"}, {"title": "Ald. Ramirez approved reasonable edits to the Archer traffic safety plan, which won't affect the protected bike lanes", "url": "https://news.google.com/rss/articles/CBMimgJBVV95cUxOVThtc25saGhvOTF4X0JySFJDWlhQd0t4X2U0NERBc1RIcTJ3cGRvVko3RFU1UmJXeHZTR1FiRExiMFY4M1k2a21YWUlnNjBsS19WdVVuMDNsMEl5MFBVbGlINlNWamFiOVZrUDQ2YWV4UTg5OUo0X21YRElpUGNaQWJ0aVBsaEtRT1pmTHZ5ZFY3ZUxvMnVvV0N5VkFvWU5RVGVWd2V0MnllSlZiZW5nOUxWTklfdXQwclBIQmtDbXpxeGcyMTlDRjctazJOd01fSWtqWHdzcGJRcjNzWnlETUl3ZmlmRDJ2b1h4a09JNjFwTVNoMWwxdEt3SFF0bHFfUUhJUzEyZzFxUEdnU243bVljQmtPeU80Y3c?oc=5", "source": "Streetsblog Chicago", "published": "2026-04-24T07:00:00+00:00"}]}, {"id": "grand-avenue", "name": "Grand Avenue Protected Bike Lanes (Phase 2)", "status": "under construction", "status_as_of": "2026-07-13", "status_note": "Phase 1 (36th Ward stretch) was built in 2023; Phase 2 toward Ogden slipped to a 2026 start and is now being built amid weekly protests and counter-rallies. CDOT and Ald. La Spata (1st) cite fewer severe crashes and less speeding on the completed segments.", "description": "Multi-phase Complete Streets project adding protected bike lanes along Grand Avenue through West Town (1st/27th/36th wards).", "wards": ["1", "27", "36"], "official_links": [], "citations": [{"title": "Second Phase Of Grand Avenue Bike Lane, Street Upgrades Now Expected In 2026", "url": "https://blockclubchicago.org/2025/08/18/second-phase-of-grand-avenue-bike-lane-street-upgrades-now-expected-in-2026/", "source": "Block Club Chicago", "published": "2025-08-18"}, {"title": "This is Grand: Scenes from Chicago's newest weekly dueling rallies against and for a Complete Streets project", "url": "https://chi.streetsblog.org/2026/04/22/this-is-grand-scenes-from-chicagos-newest-weekly-dueling-rallies-against-and-for-a-complete-streets-project", "source": "Streetsblog Chicago", "published": "2026-04-22"}], "coverage": [{"title": "Motorcyclist injured in Grand Avenue crash, road closed", "url": "https://news.google.com/rss/articles/CBMi3AFBVV95cUxQbk51M19aWDdnOVNydF9CUGRMLWZueG9jSENMQndfN1JnLUIwZGxlUFFsNHBnQXcwd1ZteXh5QTZDeEtETG1mUmRRZHJZcmg3SzlXd2xQR2QteFRFN0draE0zVnZxNFZLUjFab3JBV05vNmNVdDZQb0pZdzJsT3NqWWJtVG0xN05ka1BGekc1UmJDVzhjZm4tNUVKYmJDMXhaWlRrSVlwbTJqOG0tUG94TnBHZC02Sm5LU2UzYWFEeFREVDVkaThIWVpTMFQwMVhEODBLMkJjSnJsRWtT?oc=5", "source": "weareiowa.com", "published": "2026-07-19T22:42:00+00:00"}, {"title": "Grand Avenue bike lane barriers spark backlash, protest planned", "url": "https://news.google.com/rss/articles/CBMiZkFVX3lxTE1EMXg1NFlfSW5xSHU4WElrM2tpZ1JJbmNaaDhxZjNzOXZSRFEtUmlwYlJYRzR1el9abi1YczMzSU9VUEVSYTVQc09YTWVDOVlCSE1RUUlGem5adUxmaDhEelNsYkNzd9IBa0FVX3lxTFBMMFB5bzB4eUhpMGtKVVQ2Zmp1SFJDa3JfUkp0SVdxTUpPc192bGJYOTdwTnkyTFpJN0cyMFEydGJtbUpVWnNORjZCaGd0ZENzQ2FPZ2p6TERTemZVNEFHSmJjQ1RXSmg4R1lr?oc=5", "source": "FOX 32 Chicago", "published": "2026-05-05T07:00:00+00:00"}, {"title": "Chicago's newest bike lane fight: Grand Avenue | ChicagoLIVE", "url": "https://news.google.com/rss/articles/CBMiZkFVX3lxTE5VTVRHdDNjVjQ0UjNDQnJVR0dNcnpOUnd4UEhEcko1YmxnUE1Mb3JJbVZhSG5ZaWFRb1ozbTdTYTE1SlhSOXVKb192a043b1ctMjlTQU1BU2VCUHB6OHQ1aXFPMXFNd9IBa0FVX3lxTE53S09aWWRLamxGTUZ1ZGlaWXVuSG50cDEycXU5eUFDdEEwN0FwLTJicTladjFNZ0Jfb1FCUWpoWFZYc1RYYzBmSXBqODlxN1FHQmZydFB0MEk5ejV3a2tacUxXWXpPQ1Q2bU9r?oc=5", "source": "FOX 32 Chicago", "published": "2026-05-05T07:00:00+00:00"}]}, {"id": "dusable-lsd-redesign", "name": "DuSable Lake Shore Drive Redesign (Redefine the Drive)", "status": "proposed", "status_as_of": "2026-07-13", "status_note": "Joint CDOT/IDOT/CMAP reconstruction study; as of a May 2026 CMAP meeting the alternatives analysis was still being revised with no preferred alternative finalized. Proposed bike/ped pieces include a separated overpass at Addison and an expanded shared-use underpass at Hawthorne; advocates are pressing against a car-centric 8-lane option.", "description": "Reconstruction of the North DuSable Lake Shore Drive corridor, including its bike and pedestrian crossings and the Lakefront Trail interface.", "wards": [], "official_links": [{"text": "Redefine the Drive (official project site)", "url": "https://northdusablelsd.org/"}], "citations": [{"title": "Public opposition to plan to reconstruct DLSD as a car-centric 8-lane road intensifies at CMAP meeting", "url": "https://chi.streetsblog.org/2026/04/29/public-opposition-to-plan